,text_id,text,task_1,task_2,task_3
299,hasoc_en_300,"Over doctors resigned indians put status when Paris cathedral fired who don ' t even know about it ' s history ,  but can ' t put status supporting doctors bcs they feel high when they put story on Paris  & amp ;  feel low if they put story supporting Drs",NOT,NONE,NONE
1219,hasoc_en_1220,So what ' s had to say for himself at this then ? ,NOT,NONE,NONE
1031,hasoc_en_1032,stand with u .  . ,NOT,NONE,NONE
1453,hasoc_en_1454,Changed in last five years  . First decide religion of the  .   . if hang them otherwise protect ( some protect them politics not all )   . whatever the crime is done first decide religion .   . if you say something not happening good in means you are a  . ,NOT,NONE,NONE
776,hasoc_en_777,"Ok ans who does sirr e palace belong to ?  Who helped u murder ur wife ?  Where did u hide bibis will ?  !  She knew u well ,  thats y she kept u in jail too",NOT,NONE,NONE
1684,hasoc_en_1685,"Whenever I hear sound ,  I feel Airdrop is coming",NOT,NONE,NONE
4677,hasoc_en_4678,Happy John McCain day !  !  ! ,HOF,HATE,TIN
2837,hasoc_en_2838,"Another Congressmen Adhir R Choudhary in race to influence Gandhi family by Abusing Modi  ,  Its well known fact Sonia Gandhis Hate for PM Modi  &  Amit Shah ,  which has developed into Congress Culture ,  its still not in corrective mode but self destructive",HOF,HATE,TIN
3496,hasoc_en_3497,Just the without interrogation or Trial  .   . ,NOT,NONE,NONE
2357,hasoc_en_2358,Junior doctors refuse to meet Chief Minister her office in Nabanno and have instead asked her to meet them at NRS Medical College and Hospital as they feel insecure and apprehensive about meeting her behind closed doors,NOT,NONE,NONE
3632,hasoc_en_3633,"Good call ,  California voters :  Judge Aaron Persky ,  who gave Brock Turner lenient sentence in rape case ,  recalled from office via",NOT,NONE,NONE
1449,hasoc_en_1450,Connect the Dots to See Where Trumps Taking Us,NOT,NONE,NONE
4314,hasoc_en_4315,In India Thousands of Doctors Strike for Better Security Conditions,HOF,HATE,UNT
2932,hasoc_en_2933,"Naw ,  we ' re good .  Stay where you ' re at .   (  ) ",HOF,PRFN,TIN
1104,hasoc_en_1105,We know the real OJ . ,NOT,NONE,NONE
1776,hasoc_en_1777,"When I was in school ,  students were not allowed to tie religious threads around their wrists .  Did it mean the schools were anti - religion ?  There are rules ,  why merge everything .  so tha janta needs to understand . ",NOT,NONE,NONE
3904,hasoc_en_3905,proponents and must be disappointed that isnt under protection in,NOT,NONE,NONE
2136,hasoc_en_2137, * Rain Conditions Explained * ,NOT,NONE,NONE
4006,hasoc_en_4007,Trump admin ' s case for census question is bogus,HOF,HATE,TIN
3836,hasoc_en_3837,should take necessary action to stop happening in West Bengal,NOT,NONE,NONE
5157,hasoc_en_5158,MURDERER O . J IS A,NOT,NONE,NONE
4934,hasoc_en_4935,Trump announces he WOULD accept help from foreign governments in future elections ARE WE THIS FAR  .  GONE ?  ! ,HOF,HATE,TIN
3681,hasoc_en_3682,The arrogance of a chief minister is the reason that the has escalated so much .  It ' s a lesson to those in power that they can be brought down to their knees if they continue with a high handed approach towards workplace safety concerns of people,NOT,NONE,NONE
5457,hasoc_en_5458,"Snuggle in with your favorite homicidal maniac !  This week ,  Jess covers the brutal acts of serial killer ,  Israel Keyes .  Marci gets ragey as the details of his crimes unfold as well as the fatal mistakes that lead to his arrest . ",HOF,HATE,TIN
3347,hasoc_en_3348,My two new recliners just arrived .  And this weekend Im going to Hawaii .  But  .  .  . you have kids .  .  . awesome ! ,NOT,NONE,NONE
3346,hasoc_en_3347,Stone to death . ,NOT,NONE,NONE
3121,hasoc_en_3122,How do those US numbers compare to when Trump wasn ' t in charge ?  How do the London numbers compare to when Khan wasn ' t in charge ?  I ' ll wait .  .  . ,NOT,NONE,NONE
4501,hasoc_en_4502,Thats what warned us about ! ,HOF,OFFN,TIN
1200,hasoc_en_1201,"People who r scared with r saying there is no  .  India is witnessing mammoth crowd across Bharat to listen to ji .  I am Happy with  & amp ;  with Congress .  With this ,  is sure about",NOT,NONE,NONE
3689,hasoc_en_3690,No any individual message or logo to be displayed on any items of clothing or equipment  - ,NOT,NONE,NONE
2582,hasoc_en_2583,please at least plan future matches by considering weather .  .  . ,NOT,NONE,NONE
2097,hasoc_en_2098,"Not in his ,  or her most wild fucking dreams ! ",HOF,PRFN,TIN
5369,hasoc_en_5370,A rapist and a murderer walk into a  ( Twitter )  Bar  .  .  .  the state of,HOF,HATE,TIN
4098,hasoc_en_4099,Where was when this brute display of religion was going on in playground ?  Has they got circumcised ? ,HOF,HATE,TIN
4513,hasoc_en_4514,Ahh yes .  The Tories are responsible for Ford deciding not to make any more engines .  I get it now . ,HOF,PRFN,TIN
5461,hasoc_en_5462,May this be your last birthday as a free man . ,HOF,HATE,TIN
4113,hasoc_en_4114,Mitch McConnells Ties to Russian Oil Money The Democratic Coalition Medium,HOF,HATE,TIN
3342,hasoc_en_3343,"Its my flag as well  ,  as others across the world  & amp ;  Madonna can keep her logo on it . ",NOT,NONE,NONE
974,hasoc_en_975,STOP GIVINGOJATTENTION,NOT,NONE,NONE
3550,hasoc_en_3551,"The faces and stories of the shameful in this week .  A  ,  rapist and handful of dealers were all put behind bars . ",NOT,NONE,NONE
867,hasoc_en_868,That was the worst day of our lives .  The coward has been ruining America ever since . ,HOF,OFFN,TIN
5717,hasoc_en_5718,"When ppl wear religion on their faces in cricketing world ,  no1 objects .  They wear d logos of cigarettes n alcohol adds ,  it doesn ' t matter to anyone .  Y they want to snatch Dhoni ' s freedom of respecting his country ' s Armed Force  ?  Height of hypocrisy n meanness . ",HOF,HATE,UNT
4218,hasoc_en_4219,A war hero and a war zero,HOF,PRFN,TIN
1945,hasoc_en_1946," :   ' We ' re not outsiders ,  we ' re not BJP ,  we ' re not CPM ,  we ' re Doctors ,  '  say protesting doctors at Kolkata ' s NRS Hospital refuting Mamata Banerjee ' s claims",NOT,NONE,NONE
194,hasoc_en_195,Anderson Cooper :  All of Trump ' s threats were about nothing,NOT,NONE,NONE
2343,hasoc_en_2344,Mass resignation at Salute . ,NOT,NONE,NONE
4400,hasoc_en_4401,You really don ' t understand the difference between legal oppo research and ill - got intel from hostile foreign agents ?  ?  No wonder all the stupid people vote for you . ,NOT,NONE,NONE
2717,hasoc_en_2718,Is God a Tory ?  Waiting to be anointed . ,HOF,HATE,TIN
2601,hasoc_en_2602,"Al Bagdadi Of Bengal supporting IslamicTerrorists ,  Brutally attacking Doctors helping killers",NOT,NONE,NONE
1192,hasoc_en_1193,"The proof is called The Mueller Report .  You too can read the redacted version ,  as a citizen of the United States I felt it was my duty to read . ",NOT,NONE,NONE
4096,hasoc_en_4097,rejoices in the Trump presidency and all those who unquestioningly follow him . ,HOF,HATE,TIN
3990,hasoc_en_3991,He ' s not even fit to be an American ! ,HOF,OFFN,UNT
1696,hasoc_en_1697,Stop violence on doctors .  Take action to save the saviour  . ,NOT,NONE,NONE
1730,hasoc_en_1731,The junior doctors '  strike called in West Bengal has not just affected services in the state - government run hospitals there but also in other parts of India . ,NOT,NONE,NONE
5573,hasoc_en_5574,"Whoops ,  too late ! ",HOF,HATE,TIN
4543,hasoc_en_4544,"July  ,  Helsinki ,  Finland is all the evidence I need .  .  .  . ",HOF,HATE,TIN
4394,hasoc_en_4395,Guys a bit of a,HOF,PRFN,TIN
4221,hasoc_en_4222,"Hummm would like that .  We can pull that trigger when arent in a position to use it against us ,  with terrible results btw .  Hold that thought a bit longer ,  besides could possibly win another term before being removed from office . ",HOF,PRFN,TIN
5164,hasoc_en_5165,I wonder if there is a bigger anywhere,NOT,NONE,NONE
4293,hasoc_en_4294,THE ONLY OPTION IS TO IMPOSE PRESIDENTS RULE IN WB .  has bcum totally blind in her bid for Votes n Appeasement Politics .  Wont Attend Meeting Called by CM Mamata This Evening :  Doctors,HOF,HATE,TIN
2314,hasoc_en_2315,"The UK faces wildcat strikes and civil disobedience if Boris Johnson commits to a no - deal Brexit as prime minister ,  a group of campaigners have warned . ",NOT,NONE,NONE
4540,hasoc_en_4541,Need of the hour trends and its a matter of honour n racist mentality of rule is rule and rule for all,HOF,HATE,TIN
5205,hasoc_en_5206,Wow !  is done points already ! ,NOT,NONE,NONE
4253,hasoc_en_4254, ' England ' s rainy weather is putting a damper on cricket fans '  moods  ' ,HOF,HATE,TIN
1858,hasoc_en_1859,Indians Overwhelmingly Back Dhoni For Honouring Indian Army Soldiers,NOT,NONE,NONE
5191,hasoc_en_5192,"Trump on avoiding movie pirating :   ' of course you have to illegally download it to see if the stream is any good .  If it ' s bad ,  you slap tariffs on the country ' ",NOT,NONE,NONE
938,hasoc_en_939,So what ?  ?  who ask them to the schedul world cup in  ?  ?  They know every thing,NOT,NONE,NONE
4437,hasoc_en_4438,He is so fucking embarrassing  & amp ;  a fucking asshole,HOF,PRFN,TIN
979,hasoc_en_980,Even you haven ' t crashed the market and you bankrupted casinos .  I do know that the national debt is at an all time high and you don ' t reimburse people who loan you money . ,NOT,NONE,NONE
16,hasoc_en_17,"Wow ,  you ' re full of it",NOT,NONE,NONE
2189,hasoc_en_2190,Didi your contentious comment  ' Outsiders '  had created a chaos all around  & amp ;  the healthcare service in the country have been badly disrupted and many people are dying because of the absence of the doctors . ,NOT,NONE,NONE
2273,hasoc_en_2274,And you like What ' s your point,HOF,OFFN,TIN
1289,hasoc_en_1290,I blocked him ! ,NOT,NONE,NONE
3502,hasoc_en_3503,MAGAts will be wishing the gobshite happy bday today .  This day should be used to celebrate a man with honor not a traitor to our country .  June th is plz tweet n keep retweeting these  ' s to keep them trending all day n his bday,HOF,OFFN,TIN
2205,hasoc_en_2206,"Not doctors ,  these are medical college faculties  -  Professors ,  Associate and Assisatant Professors with years of experience .  Itll take yrs for the govt to replace them",NOT,NONE,NONE
4486,hasoc_en_4487,What pleasure do you get by killing a  ?  I dont think I am wrong in arguing would be the same feeling for a,HOF,OFFN,UNT
2319,hasoc_en_2320,Not on my life would I wish Trump a happy birthday . ,NOT,NONE,NONE
2023,hasoc_en_2024,The Untold Story of Sunny Leone via,NOT,NONE,NONE
14,hasoc_en_15,ICC denies request from BCCI to allow MSD wear gloves with Army insignia . ,NOT,NONE,NONE
3369,hasoc_en_3370,"They call the IPL a Circus .  Well ,  atleast it ' s a dry Circus . ",NOT,NONE,NONE
416,hasoc_en_417,Trump ' s birthday today .  Called Mar - a - Lago  - 561 - 832 - 2600  & amp ;  the Vancouver one  - 979 - 8888 to shout  .  Feel better already .  Join me . ,NOT,NONE,NONE
4447,hasoc_en_4448,"No flag burning ?  ?  But wasn ' t it you ,  our Supreme Kkkommander ,  who stood on stage and dry humped Old Glory at CPAC ?  THAT seems pretty un - American as well !  !  Btw remind us where you stand on foreign interference in our elections !  ! ",NOT,NONE,NONE
2861,hasoc_en_2862,I am a modi bhakt .  .  but from  - 2019 nothing done for encephalitis in bihar .  .  thats really really disappointing .  This all progress work and Yoga day are ok .  .  but we cant be silent on such severe failure of govt . ,HOF,HATE,TIN
5629,hasoc_en_5630,Why is it unqualified men in power always have an opinion on something they no nothing about  & amp ;  want to enforce it ?  Ffs .  .  .  .  . ,HOF,PRFN,UNT
1246,hasoc_en_1247,Happy Birthday President Trump ?  How about and fuck  ? ,HOF,PRFN,TIN
2475,hasoc_en_2476,What is going on .  .  .  .  .  How can we trust Johnson,NOT,NONE,NONE
175,hasoc_en_176,Has she gone looking for any remaining fragments of her soul ? ,NOT,NONE,NONE
789,hasoc_en_790,The Murderer .  Some concept i ' m doing for a short comic .  Hope you like It ! ,NOT,NONE,NONE
2963,hasoc_en_2964,How eagerly we wait for match but this rain ruin it,NOT,NONE,NONE
54,hasoc_en_55,Mamta ji pls don ' t drag Muslims in this case no one said they won ' t treat any particular religion I am a muslim pls stop speculating situation based on religion Stop playing bloody politics,NOT,NONE,NONE
5424,hasoc_en_5425,doctors have already resigned in  .  NRS SSKM National medical college RG Kar North Bengal college Murshidabad Rampurhat Burdwan,HOF,HATE,UNT
161,hasoc_en_162,"I appeal to all doctors in and throughout country ,  to return to work ,  as only poor people suffering ,  I assure I shall fight against Bengal Govt and Central govt for better security doctors !  Indian Medical Association",NOT,NONE,NONE
3288,hasoc_en_3289,not day . ,NOT,NONE,NONE
409,hasoc_en_410,"You literally admitted youd commit a felony to get elected .  Barr ,  if he actually followed the law ,  would have arrested you .  Stop harassing America .  PS :  We all know Iran is innocent and you are just trying to distract from your latest felony . ",HOF,HATE,TIN
704,hasoc_en_705,My Twitter is tiny so I see the algorithm at work .  Tweets about food v politics v tech v LGBT issues are seen by discrete sets of followers that don ' t necessarily overlap .  Maybe I should put in all my tweets to introduce everyone . ,NOT,NONE,NONE
1971,hasoc_en_1972,Thank u for selecting venue of at England now plz re designed the to  ! ,NOT,NONE,NONE
2148,hasoc_en_2149,Jamshedpur State Doctors stands in solidarity with their West Bengal counterparts,NOT,NONE,NONE
5220,hasoc_en_5221,"How Dare You ?  ?  send him to Take your asses back to Europe ,   !  !  You are the  .  You are the  ,   ,  the  !  !  this is not your land !  !   !  ! ",HOF,HATE,TIN
5076,hasoc_en_5077,Am I the only one who is beginning to think that the completely unacceptable  ' no show '  on anything from Boris Johnson is beginning to look a little odd .  Even  ' fishy '  .  He has to come out and face people now . ,HOF,OFFN,TIN
2355,hasoc_en_2356,Lulz new meme of the day  ! ,NOT,NONE,NONE
2686,hasoc_en_2687,"here in the UK there is no publicity ,  no buzz  ,  no news about the cricket and definitely no TV coverage highlights at midnight !  Uk should never be allowed to host again .  Selling a national event to Rupert Murdoch ' s Sky !  ! ",NOT,NONE,NONE
3393,hasoc_en_3394,Wow what are they thinking ?  ?  ?  Liberty  & amp ;  Middle Tenn in the same season ?  ?  ?   ' srow,NOT,NONE,NONE
5481,hasoc_en_5482,"At this point ,  we have to wonder if has told more or committed more  . ",HOF,HATE,TIN
5306,hasoc_en_5307,it ' s almost like they are doing cruel things to poor  & amp ;  marginalized people on purpose .  The only thing that outweighs their incompetence is their cruelty . ,NOT,NONE,NONE
3522,hasoc_en_3523,The Mexican ambassador to the US explains Trumps claim of a new agricultural deal,NOT,NONE,NONE
4740,hasoc_en_4741,The US military is not briefing the Deranged Donald Trump on major cyber warfare operations against a hostile foreign power because they do not trust the president not to betray those operations to that hostile foreign power . ,NOT,NONE,NONE
629,hasoc_en_630,Here is the lady in Dehradun running pillar to post for justice .  The criminal lawyer stole her cheque book  & amp ;  forged her signature and later charged her only with sec .   .  He has also thrown out the lady from her own home in false case .  He ' s a too,NOT,NONE,NONE
785,hasoc_en_786,I stand by the Doctors who are fighting for their respect  & amp ;  dignity .  They save our lives  & amp ;  are like soldiers on ground .  I strongly condemn attack on them by the goons in politics . ,NOT,NONE,NONE
1083,hasoc_en_1084,East Turkestan National Anthem,NOT,NONE,NONE
4050,hasoc_en_4051,"Oh my god ,  there are mashed potatoes where your brains should be .  You vote for a man who claims to have fallen in love with DICTATOR Kim Jong Un ,  yet you whine about gay rights . ",HOF,OFFN,TIN
4655,hasoc_en_4656,This is the face of fascism coming to America !  Remember he also signed bibles like hes the second coming of Christ . ,HOF,HATE,TIN
4044,hasoc_en_4045,THAT is a total dishonoring of the flag ! ,HOF,HATE,TIN
975,hasoc_en_976,New logo for world Cup designed by ICC,NOT,NONE,NONE
3589,hasoc_en_3590,Claims he Dazzled  | ,NOT,NONE,NONE
3976,hasoc_en_3977,Most Unpresidential President !  Youll go down in history as a year embarrassment to the U . S . ,NOT,NONE,NONE
1612,hasoc_en_1613,Biden  & amp ;  his son Hunter took advantage of their position to use Air Force to wheel  & amp ;  deal with China  & amp ;  Ukraine !  I dont trust Biden or his son Hunter who left his wife  & amp ;  kids to move in with his dead brothers wife  & amp ;  family ! ,HOF,HATE,TIN
3116,hasoc_en_3117,How Trump ' s  ' fake news '  rhetoric has gotten out of control,NOT,NONE,NONE
2278,hasoc_en_2279,We have seen through various peaceful means possible .  And all of us must stand with them . Their well - being is important to us not only because they are doctors but also because they are fellow citizens .  because every life matters  -  theirs included ! ,NOT,NONE,NONE
5206,hasoc_en_5207,Your whole presidency is fake ! ,NOT,NONE,NONE
2598,hasoc_en_2599,Leaving it up to the judgement of one person in a powerful position is foolishness that has pervaded the last few years and must stop .  We should be in the streets making the next step an inevitability . ,NOT,NONE,NONE
4877,hasoc_en_4878,trumps birthday is tomorrow how many times do you think we can all tweet in one day,HOF,PRFN,TIN
1424,hasoc_en_1425,Well HAPPY FUKING BDAY TO YOU A $  $ HOLE .  .  .  . MAY IT BE YOUR LAST is his last,HOF,PRFN,TIN
2417,hasoc_en_2418,"Boris Johnson is full of shit ,  he wants the prime minister role as its the only toy the spoiled bastard as never had ,  its ok for him to play with U . K .  n toss it when broken ,  normal people will be the ones suffering whilst that mega rich lying bastard wont give a flying fuck",HOF,PRFN,TIN
2087,hasoc_en_2088,Jab Balidaan likha hi nahi hai toh why the unwanted controversy .  So but drops the  . ,NOT,NONE,NONE
5392,hasoc_en_5393,Fantastic planning in creating fixtures for england matches .  Look at the weather predictions for and  .  Same venue but different days with different weather to be expected .  Just directly hand over the trophy to england dan playin like this,HOF,HATE,TIN
372,hasoc_en_373,"Am I the only one who feels like its no longer a question of if  ,  but rather if Republicans are still Americans ? ",HOF,HATE,TIN
1100,hasoc_en_1101,Let ' s support our Doctors,NOT,NONE,NONE
1459,hasoc_en_1460,"All doctors are on Strike  .  .  .  Thats only for a common family  .  .  .  I want to ask on Stike doctors  .  .  If a rich man ,  leaders even will be sick in this situation  .  .  .  will they stay on strike  .  .  .  .  .  .  No and never  .  .  .  . ",NOT,NONE,NONE
4057,hasoc_en_4058,The pretending president says nothing .  SMFH,HOF,OFFN,TIN
3761,hasoc_en_3762, '  says cannot wear  ' army logo '  gloves ' ,NOT,NONE,NONE
4069,hasoc_en_4070,Idiot Cricket Council  -  Did you plan the ICC Cricket World Cup assuming it will be played in Dubai  ? ,HOF,PRFN,TIN
5256,hasoc_en_5257,The has no soul,HOF,PRFN,TIN
665,hasoc_en_666,Trump trying to take us to another war ! ,NOT,NONE,NONE
3919,hasoc_en_3920,Really Steve isnt working with you on big issues ?  You mean like not bringing any bills to the floor to protect our elections ?  But hell its only Our Democracy you refuse to protect,NOT,NONE,NONE
2513,hasoc_en_2514,IMA meeting with striking docs remains inconclusive,NOT,NONE,NONE
3118,hasoc_en_3119,"Trumps corruption ,  hate rhetoric and CRIMINAL actions are eroding our democracy !  !  What POTUS invites foreign adversaries to influence our elections ?  !  !  ! ",HOF,HATE,TIN
1248,hasoc_en_1249,Happy Happy Happy Happy,NOT,NONE,NONE
4498,hasoc_en_4499,Criminalizing Freedom :  The Attacks on Abortion Rights and Free Speech in the Age of Trump,HOF,OFFN,TIN
2886,hasoc_en_2887,How many more abuses and apologies  ?  ?  ?  ?  Action needs to be taken against such people,HOF,HATE,UNT
2609,hasoc_en_2610,It is too very unnatural on seeing the arrogant nature of and the organising sector of  .  How can ICC defend itself by not allowing reserve days for all matches .  Dear You must change your nature . ,NOT,NONE,NONE
813,hasoc_en_814,"Vegan food is not always necessarily more healthy .  Vegan food is MORE than meat !  Do NOT be such a bandwagon jumping ,  gullible ,   !  is NOT  !  is processed ,  or not !  Make your own  ! ",NOT,NONE,NONE
3859,hasoc_en_3860,Should change the venue for semifinal and finals,NOT,NONE,NONE
4966,hasoc_en_4967,Trumps best people . ,HOF,HATE,TIN
2623,hasoc_en_2624,Still waiting to hear what agreement we made with Mexico to stop illegal immigration .  hasnt provided us any details .  got played .  His own party was against him . ,NOT,NONE,NONE
4329,hasoc_en_4330,That was about as insincere and fake as you can be !  Nice job with the fake crying and sniffles !  Lol,HOF,HATE,TIN
3641,hasoc_en_3642,"I ' ve met  ,  you ' re no Jackie Kennedy .  She had class and dignity .  She married a war hero ,  not a coward or Soviet mole .  She wasn ' t a whore . ",NOT,NONE,NONE
4566,hasoc_en_4567,A career politican quoting ethics .  Now that is funny . ,HOF,HATE,TIN
5189,hasoc_en_5190,"So keeps praising  ,  a as somebody with great leadership who just wrote him a  ' beautiful letter '  WTF ! ",HOF,OFFN,TIN
2749,hasoc_en_2750,Now we can confirm the true crisis at the border now that Canada has won the finals ? ,HOF,PRFN,TIN
3493,hasoc_en_3494,fuck trump and his bullshit,HOF,PRFN,TIN
2515,hasoc_en_2516,is trending at nd,NOT,NONE,NONE
5661,hasoc_en_5662,Now i am worried for my life not patients if this mentality of people continues doctor will not take risks to save the patient even he will not touch the patient because of fear of getting punch and freehaemorrhage  ' and injustice,HOF,HATE,TIN
5803,hasoc_en_5804,admitting he would be willing to compromise electoral sovereignty in the country he purports to preside over should anger all Americans .  It is openly treasonous and an insult to every person who has fought to defend our institutions . ,HOF,HATE,TIN
2970,hasoc_en_2971,Followed and blocked,HOF,HATE,TIN
805,hasoc_en_806,Sanders knew she was lying and admitted it under sworn testimony,NOT,NONE,NONE
5403,hasoc_en_5404,Ahhh did trump ' s feelings get hurt ?  Too bad it ' s and trump is,HOF,HATE,TIN
1016,hasoc_en_1017,Looks like somebody doesn ' t understand what Treason is . ,HOF,HATE,TIN
5798,hasoc_en_5799,When you lets the news outlets tell your story .  .  . stop letting the news paint false narratives of our black ppl .  . But for dumpster rapist gets a nice portrait,HOF,OFFN,TIN
5670,hasoc_en_5671,"orders to pay his  ,   ,  just in compensation  -  Jun  : 49 AM ET",HOF,HATE,TIN
5571,hasoc_en_5572,"That is plain evil ,  & amp ;  UR dept took that minion ' s word with ZERO proof ?  UR as deranged as he is ,  and just as culpable as that killer !  I ' ve ALWAYS backed the Blue  & amp ;  always will !  But I ' ll never stand with those who are just as cruel / evil as criminals are ! ",HOF,HATE,TIN
4685,hasoc_en_4686,"As I always said ,  the deals b / w Zameer Ahmed  & amp ;  Mansoor Khan is out ,  many other bigwigs are also part of this scam .  I strongly demand the investigation to be handed over to CBI ,  which is the only ray of hope for the thousands of victims of  . ",HOF,HATE,TIN
684,hasoc_en_685,When are we ready to admit we done with tolerating,NOT,NONE,NONE
4571,hasoc_en_4572,"But you can ' t physically attack someone on Twitter and lop their head off if they upset you ,  like you did to  .  You can ' t slash and stab here ,  like you did to  .  I ' m not sure if this is the place for you ends in",HOF,OFFN,TIN
4118,hasoc_en_4119,please change the cup design as below for the edition,HOF,HATE,TIN
2791,hasoc_en_2792,Who is Trump ? ,HOF,HATE,TIN
4556,hasoc_en_4557,Go .  Away .  Stay .  Away . ,HOF,HATE,TIN
5407,hasoc_en_5408,"We have ZERO interest in playing GOD ,  so please don ' t treat us either as a GOD or as a DOG !  If you deserve respect ,  so do we ,  nothing more and nothing less .  .  . ",HOF,HATE,UNT
4839,hasoc_en_4840,The secret behind the game . ,NOT,NONE,NONE
1766,hasoc_en_1767,"See ,  who is giving lecture on Abuse . ",NOT,NONE,NONE
3758,hasoc_en_3759,"When played last people watched .  If it rains on Sunday ,  it ' s gonna be a huge loss to  ( financially )  .  What a poor planning  !  !  ! ",NOT,NONE,NONE
4736,hasoc_en_4737,What an idiot .  As If .  .  . ,NOT,NONE,NONE
3826,hasoc_en_3827,"ICC didn ' t give the permission to Dhoni to wear the glove with the Balidaan badge .  We all know what happens when people mess with Kohli .  Now ,  we ' ll see what happens when you mess with Dhoni .  Remember this tweet . ",NOT,NONE,NONE
2458,hasoc_en_2459," \ nCongress mind set is well reflected after the real buggering defeat .  Anger ,  Frustration ,  Dead End .  \ nIt is similar to the Anger of King Dirudhirashtra father of Duryodan in Mahabharat after the war when his entire sons including Duruyodna were killed by Bhim . ",NOT,NONE,NONE
2736,hasoc_en_2737,"Of all Boris Johnsons appearances on TV ,  tonight was definitely my favourite . ",HOF,HATE,TIN
4242,hasoc_en_4243,House has to have guts to go after Trump,HOF,PRFN,TIN
222,hasoc_en_223,"Glad to see her go ,  hate to watch her leave .  Who ' s up to replace her ?  Mad Dog Hate Speech Pirro ? ",NOT,NONE,NONE
1808,hasoc_en_1809,"his biggest threat is Boris didnt turn up ,  hed be sat at home watching taking notes to see what elements of the candidates he can pinch to elevate his potential .  We need hope in this declining country ,  with Boris no chance",NOT,NONE,NONE
