,text_id,text,task_1,task_2,task_3
3979,hasoc_en_3980,Well done  .  What a great schedule !  !  The biggest cricketing action is washing out due to rain .  Very poor from and We won ' t be calm if this repeats in most awaited indo - pak game .  Be very careful !  ! ,NOT,NONE,NONE
3627,hasoc_en_3628,Trendy TSHIRT DESIGN WITHIN HRS,NOT,NONE,NONE
3386,hasoc_en_3387,Stopping from wearing the Glove would mean stopping English players from wearing the poppy .  Would do that ?  There is nothing wrong in displaying a spirit of nationalism after all its an international tournament .  JaiHind . ,NOT,NONE,NONE
3420,hasoc_en_3421,is a scumbag attorney .  A mother of is murdered and you act like a pompous arrogant prick .  Good job douche your mother must be so proud of u .  GUILTY,HOF,OFFN,TIN
2668,hasoc_en_2669,U . S .  court rules against in immigrant teen abortion case,NOT,NONE,NONE
5435,hasoc_en_5436,Its jst horrible how icc hv planed the matches its world cup not county or local leagues v wait for yrs to watch rain in England,HOF,HATE,TIN
58,hasoc_en_59,"just going to leave this here keep your eyes and mind open to how the media portray people and remember ,  question everything",NOT,NONE,NONE
5412,hasoc_en_5413,Will become more infamous than Bendict Arnold .  Mark my words . ,HOF,HATE,TIN
2457,hasoc_en_2458,People of  .  .  To what level do we want to stoop to ?  This highly objectionable as time and again we have seen any tom dick harry hurling abuses at our H ' nble PM as again resurfaces STOP IT ! ,NOT,NONE,NONE
4338,hasoc_en_4339,"I love how he pulls that bush league shit but remembers to thank his lord and savior before he crosses the plate .   ,   . ",HOF,HATE,TIN
4386,hasoc_en_4387,Too bad you are pretending to be a politician in real life .  And it is too bad that the people of Ontario suffer while you and your lying boss continue to pretend . ,NOT,NONE,NONE
4514,hasoc_en_4515,"Oga Ahmed ,  I would love if the report you came to gave is that your friend couldn ' t know what to do with the head of the rapist but you guys are you way to police to hand over the Useless head ,  you will need all the support to back up what has been done .  must die",HOF,HATE,TIN
2048,hasoc_en_2049,"Dreamt Boris ,  chasing down street after a leadership rival .  As he reaches him .  .  .  Boris :  Hello -  Rival :  Boris ,  it ' s already a lie .  Savage burn . ",NOT,NONE,NONE
1402,hasoc_en_1403,All they are concerned about who wore which badge .  No wonder the popularity of the game is decreasing . ,NOT,NONE,NONE
1957,hasoc_en_1958,"Seniors greeted  & amp ;  cheered by juniors after mass resignation .  .  There is an old saying that united we stand ,  divided we fall .  This is unity .  .  Dear momos waale didi no matter how much u gonna humiliate our doctors ,  we will stand by them forever . ",NOT,NONE,NONE
5810,hasoc_en_5811,"And republicans compare this gold - digging  ' I ' ll do anything to stay in this country '  stripper to Jackie Onassis !  You are so right ,  some trashy shit .  It ' s disgusting that Russians put this crap in the WH . ",NOT,NONE,NONE
4816,hasoc_en_4817,Decisive response should be to bomb MBS,HOF,HATE,TIN
3911,hasoc_en_3912,Id believe a talking anus over trump . ,NOT,NONE,NONE
2800,hasoc_en_2801,"There is no poll that says don ' t impeach ,  unless it is only inside your head . ",HOF,HATE,TIN
2168,hasoc_en_2169,American hunter says she has no regrets about killing a black giraffe via,NOT,NONE,NONE
3957,hasoc_en_3958,Trump is the biggest traitor in American history .  RT if you agree . ,HOF,OFFN,TIN
2744,hasoc_en_2745,I would bet That Trump has a welcome mate to all foreign powers who have information on the democratic party the oval office doorway . ,HOF,HATE,TIN
5605,hasoc_en_5606,now Mamata CM WB wants to meet injured Dr Paribaha Bannerjee .  This means ultimately Mamata has lost .  RT if you agree . ,HOF,HATE,TIN
929,hasoc_en_930,We r proud of u MSD  .  . ,NOT,NONE,NONE
4703,hasoc_en_4704,R .  Kelly is a Child Molester and Sexual Predator Lock R .  Up !  ! ,HOF,PRFN,TIN
1144,hasoc_en_1145,"Oh ,  you poor dear .  .  .  Fasten your seatbelt .  This is only the beginning . ",NOT,NONE,NONE
1831,hasoc_en_1832,Situation in serious .  But still scope for a laugh .  cartoon . ,NOT,NONE,NONE
5293,hasoc_en_5294,Halfway through  ' When They See Us '  and ANGRY AF .  I don ' t have words .  I cannot imagine the shit show these men have been through . ,NOT,NONE,NONE
1672,hasoc_en_1673,went from to,NOT,NONE,NONE
1199,hasoc_en_1200,Happy,NOT,NONE,NONE
5118,hasoc_en_5119,THIS IS HORRIBLE !  !  !  !  THIS IS ANTI - AMERICAN !  !  !  !  AND,HOF,PRFN,TIN
4515,hasoc_en_4516,"Condemn a foreign power who attacked our democracy ?  ohhh ,  you must be talking about Benghazi .  You rememember that right Hill ?  Where Americans were killed while you ignored their requests for help . ",HOF,HATE,TIN
4478,hasoc_en_4479,Someone is dying for daddy ' s attention . ,HOF,PRFN,UNT
707,hasoc_en_708,"Uh trump is BEHIND in EVERY poll an invited illegal foreign campaign interference on national television .  Yes ,  it ' s all going exactly to plan . ",NOT,NONE,NONE
117,hasoc_en_118,uat is doing they have objection on,NOT,NONE,NONE
345,hasoc_en_346,"Dhoni Is Always Right ,  Left And Centre ! ",NOT,NONE,NONE
279,hasoc_en_280,"According to the weatherman ,  there is a high chance of rain during India Vs Pakistan on June  ,  in the ongoing Cricket World Cup .  What have u done ICC",NOT,NONE,NONE
2626,hasoc_en_2627,Donnie .  .  .  .  . youre just saying that because he was mean to you !  He let the Baby Trump blimp fly !  He let thousands of protesters line the streets of London !  !  YOU .  .  .  . Donnie are the disgrace !  ! ,HOF,HATE,TIN
2708,hasoc_en_2709,"Some of you out there aren ' t old enough to remember this travesty .  A total miscarriage of justice .  Not everyone you follow is worthy ,  least of all a  . ",NOT,NONE,NONE
5098,hasoc_en_5099,"What happened to you ,  mike ?  ?  ?  ? ",HOF,PRFN,TIN
4187,hasoc_en_4188,and should have some sort of communication will have two final on same day  .  How can someone be so wrong on planning such an important event pathetic planning,HOF,HATE,TIN
4479,hasoc_en_4480,"So has time to go to talk gibberish with Suman ,  FOR AN HOUR ,  but DONT HAVE A MINUTE to come to NRS Hospital and talk to junior doctors .  Slow claps . ",HOF,HATE,TIN
1658,hasoc_en_1659,Happy,NOT,NONE,NONE
616,hasoc_en_617, .  ICC on Dhoni ' s gloves Vs  .  ICC planning the World Cup Agree - ,NOT,NONE,NONE
5244,hasoc_en_5245,"Are you politicians insane in Bengal ?  This is about lives of our people  -  patients and doctors .  Come on this is about security of doctors ,  this is about life .  Let your egos take a walk . ",NOT,NONE,NONE
3367,hasoc_en_3368,Worst World Cup BCCI can organize the entire world cup more efficiently,NOT,NONE,NONE
1809,hasoc_en_1810,Part of the Hitler Youth League .  What do you expect . ,NOT,NONE,NONE
2782,hasoc_en_2783,You ' re LYING to America and HIDING legislation from debate and votes !  If you believe in your  ' Senate Majority '  then bring the bills to the floor !  If you ' re on the right side of the issue you ' ll win .  If not then GTFO . ,HOF,PRFN,TIN
4340,hasoc_en_4341,What KILLS me about this is that old Trump - sucker spent YEARS calling President Obama  ' President Kardashian .  '  I ' m sure that drug - addled fool has already found a way to spin THIS as a GOOD thing for Donald Trump .  FUCKING HYPOCRITE,HOF,PRFN,TIN
3766,hasoc_en_3767,AIIMS Issues Hours Ultimatum To CM Mamata Banerjee,NOT,NONE,NONE
4629,hasoc_en_4630,Doctors in India  =  Mandir ka ghanta Stop treating us like this,HOF,HATE,UNT
348,hasoc_en_349,"Have to say ,  a great benefit to having a known pathological liar as president is when he tries to start a war ,  no one believes him",HOF,OFFN,TIN
3227,hasoc_en_3228,Im definitely feeling harassed by you at this point .  So we finally agree on something ! ,NOT,NONE,NONE
2698,hasoc_en_2699,Pic  :  Indian grounds Pic  :  other grounds Are mad for choosing England for the venue of you may consider the climate there,NOT,NONE,NONE
4883,hasoc_en_4884,This world cup should be ban  !  !  Rain rain rain motherfuckerr ICC Shift this world to another country or ban this world cup,HOF,PRFN,TIN
427,hasoc_en_428,Didi wouldn ' t let it go down too well .  Will she ?  Her own MP is in for  . ,NOT,NONE,NONE
5497,hasoc_en_5498," ( cmon Sarah ,  one more lie from you before you go .  )  \ n \ nOur president is a documented serial liar .  Im inclined to believe Ms .  Carol and not trust a word hes saying .   \ n \ nThis : ",HOF,OFFN,TIN
4131,hasoc_en_4132,People having terrorism in their DNA should not open their mouth to raise question on patriotism of MSD . ,HOF,HATE,UNT
539,hasoc_en_540,"This is a nexus of unholy cricket business run between the Netas from all party  - lines  ,  so until the BJP neta ' s do not will it  ,  its not going to change a darn bit  !  Sadly",NOT,NONE,NONE
430,hasoc_en_431,Countries sponsoring must be held accountable :  PM Modi at In,NOT,NONE,NONE
4798,hasoc_en_4799,YOU ARE A STAIN ON THIS COUNTRY ' S HISTORY .  YOU SHOULD BE ASHAMED OF YOURSELF AND YOUR ADMINISTRATION . ,HOF,OFFN,TIN
5711,hasoc_en_5712,What in the hll is wrong with her ! ,HOF,OFFN,UNT
2685,hasoc_en_2686,Misspelled  ' getting evicted from medieval monastery you can ' t afford ' ,NOT,NONE,NONE
1159,hasoc_en_1160,Either rain or one sided games .  This World Cup sucks big fucking time . ,HOF,PRFN,TIN
5354,hasoc_en_5355,Hope you are getting paid minimum wage for your twitter tripe .  Bye  ! ,HOF,PRFN,TIN
1423,hasoc_en_1424,Something is really going wrong when the saviours are protesting to be saved,NOT,NONE,NONE
1588,hasoc_en_1589,Seniors greeted and cheered by juniors after mass resignation .  .  This is life .  .  This is unity .  .  This is pride .  .  Kudos . ,NOT,NONE,NONE
870,hasoc_en_871,Nuf said . ,NOT,NONE,NONE
4643,hasoc_en_4644,It ' s Getting Pretty Hard Not To Get Ejected From A Game ngel Hernndez Is Umpiring,HOF,HATE,TIN
2918,hasoc_en_2919,"The Terrorist  ,  Waris Pathan is batting well with Abuse ,  verbal Terrorism at",HOF,HATE,TIN
5539,hasoc_en_5540,Baki Jo bhi ho but you are from,HOF,OFFN,TIN
1282,hasoc_en_1283,"That is none of your business !  That Mayor tells the truth so naturally you hate him .  Slander ,  lies and hatred .  The Trump mantra ! ",NOT,NONE,NONE
3030,hasoc_en_3031,community WTF is that of yall on code with that shzt ! ,NOT,NONE,NONE
2822,hasoc_en_2823,"Severos Vellark .  Crane doctor who was supposed to be the personal doctor to Rena Kalil but said fuck that and opened a free clinic in the slums .  Constantly exhaustd .  Saved Mikata ' s life at one point ,  and they ' re fwbs .  Aromantic . ",HOF,PRFN,UNT
5572,hasoc_en_5573,"It is not a secret ,  all of the world knows our President is compromised . ",HOF,HATE,TIN
5066,hasoc_en_5067,KEEP on the Press  .  .  they still wont publish news AND Want to keep presenting TRUMP AS VICTIM MEME .  .  whaddya think about that IS TRUMP the victim in his  $ 1 . 5Million payment for of OWN CHILD conceived on Ivanka lookalike ? ,HOF,HATE,TIN
3246,hasoc_en_3247,I hate killed or had someone kill my mom .  I swear to and I have from it .  I wouldnt just say that on or  .  My mom died at and was completely over heart failure and goes to and the next week she dies on the toilet . ,NOT,NONE,NONE
5209,hasoc_en_5210,"How can Lowri say that it was the right decision for Boris to avoid appearing ,  and even spin it as a positive ?  This is how people without critical thinking analyse things ,  they fall for the nonsense . ",NOT,NONE,NONE
4614,hasoc_en_4615,Really only one response to Trump at this point .  TRAITOR,HOF,HATE,TIN
230,hasoc_en_231,I will never forget what you did to the  !  Now known as the,NOT,NONE,NONE
994,hasoc_en_995,Better watched your head . ,NOT,NONE,NONE
5115,hasoc_en_5116,Hey TRAITOR Take info from an Enemy of the United States ?  You are learning Comrade Stewart !  Soon you will be welcomed back to Mother Russia as a hero ! ,NOT,NONE,NONE
962,hasoc_en_963,"people ,  we have to do whatever is possible to stop this fake activist from sabotaging our movement . ",NOT,NONE,NONE
5141,hasoc_en_5142,This guy isnt worth your time Charlie . ,NOT,NONE,NONE
2796,hasoc_en_2797,Treo by Milton Giara Bottle Silica Glass ml Pc  ( in colors )  Rs . 336,NOT,NONE,NONE
2806,hasoc_en_2807,Congratulations Michael Phelps for winning Cricket World Cup  (  ) ,HOF,HATE,TIN
3186,hasoc_en_3187,A cricket lover never wants to saw this on big screen .  Four matches are abandoned due to rain and almost every team is affected by this .  Please choose a better country for the next time to host this prestigious tournament,NOT,NONE,NONE
1454,hasoc_en_1455,"I disagreed with many of his policies ,  but he had conviction and principles ,  plus the whole war hero thing . ",NOT,NONE,NONE
4323,hasoc_en_4324,ICC guys before planning WC,HOF,HATE,TIN
1852,hasoc_en_1853,Back in the days  ( 2014 ?  ) when Ive was drawing a graphic novel for  .  .  . ,NOT,NONE,NONE
3854,hasoc_en_3855,ICC turns down  ' s request to allow to continue wearing the army insignia on his wicket - keeping gloves ;  ICC says regulations for ICC events do not permit any individual message or logo to be displayed on any items of clothing or equipment . ,NOT,NONE,NONE
439,hasoc_en_440,Fascinating summary of UK candidates records after the for which may decide or  :   (  & amp ;  thank goodness we didnt have to listen to  ) ,NOT,NONE,NONE
5694,hasoc_en_5695,Happy John McCain day everyone . ,HOF,PRFN,TIN
1985,hasoc_en_1986,Wheres Walley .  Oh l mean wheres They seek him here they seek him there . ,NOT,NONE,NONE
3457,hasoc_en_3458,"Apparently ,  Kakoli Ghosh Dastidar thinks that Dr . Paribaha would not survive if the government did not pay .  And your party is the one who is threatening his family .  If you think you ' re powerful ,  you would not need to blackmail him .  SHAME ON YOU . ",NOT,NONE,NONE
4710,hasoc_en_4711,"Because there are no consequences to individual  .  He basically advertised for free on TV that he is open to foreign help .  Case by case ,  using what criteria ? ",HOF,HATE,TIN
2451,hasoc_en_2452,"Except for a reversal on position of DACA ,  except Trump ' s properties are among the employers taking advantage of illegal immigrants ,  except Trump lowered the number of refugees the US will accept .  But ,  yeah ,  pretty much the same . ",NOT,NONE,NONE
5023,hasoc_en_5024,Who cares . ,NOT,NONE,NONE
1235,hasoc_en_1236,"Tremendous crowds ?  I was there this afternoon ,  and this was the scene  .  Check out the protests tomorrow",NOT,NONE,NONE
2807,hasoc_en_2808,Bitch please he has / had no compassion for the Central Park this shit is a stunt .  Not saying her intentions isn ' t pure Trump shit is not .  I need her to ask him about them babies in cages . ,HOF,PRFN,TIN
5078,hasoc_en_5079,In case still thinks my people like him . ,HOF,HATE,TIN
2872,hasoc_en_2873," .  .  .  . Irans very ignorant and insulting statement ,  put out today ,  only shows that they do not understand reality .  Any attack by Iran on anything American will be met with great and overwhelming force .  In some areas ,  overwhelming will mean obliteration .  No more John Kerry  &  Obama ! ",HOF,HATE,TIN
822,hasoc_en_823,Hmmmmmm .  This seems ironic and hypocritical with that we have in the WH . ,NOT,NONE,NONE
27,hasoc_en_28,Disgusting !  And they dont change their culture or come up with vetting system or preventative ways to stop this from occurring .  This will continue to happen .  The Catholic Church needs to go ! ,HOF,HATE,TIN
3274,hasoc_en_3275,"Happy Birthday from your nemesis John McCain today ,  your age  =  your IQ",NOT,NONE,NONE
1414,hasoc_en_1415,"The forces girls and women not only to have a child of their  ,  it also forces them to stay in contact to the criminal ,  because the rapist will be awarded with joined legal custody of the child",NOT,NONE,NONE
2680,hasoc_en_2681,Look at him .  .  . enjoying life .  .  . He robbed people of theirs and couldnt care less .  .  . ,NOT,NONE,NONE
4838,hasoc_en_4839,"Do NOT question our humanity . I dare you to broadcast this , though , of course , you won ' t .  They are Indradeep ,  Amresh & amp ; Chinmay of final year ( 4th year )  . ",HOF,HATE,TIN
2156,hasoc_en_2157,It was a Miracle .  A Russian Miracle ! ,NOT,NONE,NONE
2139,hasoc_en_2140,The danger of lies in its ability to silence the It is a sophisticated form of which resulted in,NOT,NONE,NONE
3617,hasoc_en_3618, .  What exactly do you have against securing our elections ?  Afraid you wont win unless you have help ? ,NOT,NONE,NONE
2282,hasoc_en_2283,Dear ICC focus on improving the standard of Umpiring . Which is important than then dhoni ' s Gloves . ,NOT,NONE,NONE
3526,hasoc_en_3527,doctors have already resigned in NRS SSKM National medical college RG Kar North Bengal college Murshidabad Rampurhat Burdwan,NOT,NONE,NONE
2887,hasoc_en_2888,"By abusing the people elected PM ,  the opposition has insulted the people of this country .  \ n",HOF,HATE,TIN
4056,hasoc_en_4057,Your own people keep information from you because THEY ALL KNOW you are an IDIOT !  !  !  ! ,HOF,PRFN,TIN
2675,hasoc_en_2676,Some day you will be able to use the program yourself if you not in for life ! ,NOT,NONE,NONE
2966,hasoc_en_2967,Dont feel sorry for this woman . ,HOF,HATE,UNT
2174,hasoc_en_2175,"The CM of the State ,  also the Health Minister ,  and such a ruthless response to the State Governer ?  ?  has completely lost the The situation is worse than what is actually looks from the videos / pictures at Social media  & amp ;  News",NOT,NONE,NONE
538,hasoc_en_539,And you hang around with the likes of Jacob  $  $ Wohl .  I had to look you up as I had no idea who the eff you even were .  Found out that you weren ' t anything . ,NOT,NONE,NONE
1480,hasoc_en_1481,"I ' m not a med student  .  But I support our future doctors ,  I support their professors and I support their parents .  We should be one man one voice .  But not only med students are in danger ,  all Moroccan students are in danger . ",NOT,NONE,NONE
2186,hasoc_en_2187,be yourself fuck everyone else luv u,HOF,PRFN,TIN
4077,hasoc_en_4078,"Bring Donald to justice .  He raped this woman ,  when she was  .  He ' s a serial long time  . ",NOT,NONE,NONE
4237,hasoc_en_4238,Kenneth Clarke :  If theres no other way youve got to bring the government down The Tory veteran talksof his dismay at the fantasies of the leadership race and his fears if Boris Johnson becomes PM,HOF,HATE,TIN
2195,hasoc_en_2196,thank you for ruining the most awaited tournament in India,NOT,NONE,NONE
5213,hasoc_en_5214,Pelosi :  Trump shows he doesn ' t  ' know right from wrong ' ,NOT,NONE,NONE
1532,hasoc_en_1533,so sorry from,NOT,NONE,NONE
1506,hasoc_en_1507,Token strike today .  Various hosp  & amp ;  med colleges of Delhi supporting and standing in solidarity wid our colleagues from WB .  It may escalate if CM doesn ' t take any concrete action . Need for strict central laws  & amp ;  their implementation as  & amp ;  when reqd . ,NOT,NONE,NONE
5511,hasoc_en_5512,Jesus suffering fuck !  Hunt or Johnson .  Hands up everyone who is now up for a shit load of chaos with Ed Miliband ? ,HOF,OFFN,TIN
2716,hasoc_en_2717,"It has always rained in England during chmpions trophy and other major tournaments .  Such poor scheduling of cwc  ,  no reserve day  ,  poor ground conditions ,  poor preparations . ",HOF,HATE,TIN
4295,hasoc_en_4296,Ya I think he already did that .  And got away with it . ,HOF,HATE,TIN
1862,hasoc_en_1863,"Paediatrician seeing his patients while on protest rally .  Didi  & amp ;  her goons ,  DON ' T DARE TO TEACH US HUMANITY This is not a VACATION of doctors .  This is NOT Patients Vs Doctors .  This is against tyranny , safeguarding criminals  & amp ;  insecurity . ",NOT,NONE,NONE
191,hasoc_en_192,Trump ' s GOP allies privately cringe at dirt comments,NOT,NONE,NONE
2300,hasoc_en_2301," .  That was at  ,  now its am .   .  I dont owe you shit  .  Dont fucking break in",HOF,PRFN,TIN
5533,hasoc_en_5534,He should still be serving out his murder conviction . ,NOT,NONE,NONE
1929,hasoc_en_1930,I was a lifelong Conservative until the referendum .  Just joined the Liberal Democrats .  That is the measure of your success . ,NOT,NONE,NONE
2311,hasoc_en_2312,Im not saying is a russian asset but the russian sure say he is ! ,NOT,NONE,NONE
374,hasoc_en_375,"It would be irresponsible for Tory MPs to opt for  ,  perhaps more irresponsible than holding a  %  threshold referendum .  For the Countrys and Partys sake please go for  ! ",NOT,NONE,NONE
2184,hasoc_en_2185,Would make perfect sense if it was,NOT,NONE,NONE
4652,hasoc_en_4653,"She blocked a bill that would make whats already illegal ,  illegal .  It is illegal to accept any foreign help in an election campaign .  You broke the law  & amp ;  you said youd do it again .  What good are laws when the president himself is more than willing to ignore them ? ",HOF,PRFN,TIN
1207,hasoc_en_1208,"Dude  .  .  .  youve all but admitted your crimes .  Give it a rest  -  we all know youre guilty ,  inept ,  uneducated and crapping all over the Constitution . ",HOF,OFFN,TIN
5552,hasoc_en_5553,in addition to being mentally ill . ,HOF,HATE,TIN
4848,hasoc_en_4849,Kiss harder Mark and you might get a job in with the other jokers in the cabinet . ,HOF,HATE,TIN
1514,hasoc_en_1515,Waiting for years for such a grand Tournament and four - matches are abandoned next time be focused on the venue instead on the wicketkeeper ' s gloves,HOF,HATE,TIN
5478,hasoc_en_5479,There is no doubt that the Russians would be thrilled to see Boris Johnson succeed .  They would have disrupters in both the White House and Number  . ,HOF,HATE,TIN
4928,hasoc_en_4929,"If all remaining get washed  :  NZ  -  Ind  -  Eng  -  Aus  -  WI  -  SL  -  Pak  -  Bang  -  SA  -  Afg  -  Semi Final Aus vs NZ  ( If rain continues )  ,  NZ Eng vs Ind  ( If rain continues )  ,  Ind Final Ind vs NZ  ( If rain continues )  ,  NZ  -  India will win jointly  . ",HOF,HATE,TIN
4140,hasoc_en_4141,"Sure ,  the  %  would never have had their pockets bulge without around .  Great job",HOF,OFFN,TIN
885,hasoc_en_886,"Unlike your  ' Absolute ,  Real and Physical act of treason .  .  !  ' ",NOT,NONE,NONE
5725,hasoc_en_5726,oval office moron embarrasses u . s .  again . ,HOF,PRFN,UNT
5730,hasoc_en_5731,"How do you expect them to have chins if their daddy has a double chin ,  plus his daughters vagina underneath his face  ? ",HOF,PRFN,TIN
2167,hasoc_en_2168," ' Presidential '  incompetence ,  corruption ,  and treason !  !  !  ! ",NOT,NONE,NONE
1026,hasoc_en_1027,"People Think Rohit Steal the Show .  But they Don ' t know ,  What happen After That",NOT,NONE,NONE
1268,hasoc_en_1269,According to rule shouldn ' t wear the and Indian shouldn ' t always take the advantage of it ' s population . ,NOT,NONE,NONE
3591,hasoc_en_3592,On another post I called him what he is  & amp ;  the blocked me .  LOL,NOT,NONE,NONE
1594,hasoc_en_1595,Even local cricket tournament have better management  & amp ;  planning than your ' s  .  Thankyou for spoiling the worldcup . ,HOF,HATE,TIN
3916,hasoc_en_3917,Liar !  You have no rights to make decisions on behalf of women .  This is NOT infanticide but the kids YOU are killing at the border is indeed . ,NOT,NONE,NONE
102,hasoc_en_103,So it looks like the lying incompetent homophobic racist will be the next leader .  .  . well at least well get a eh Boris ? ,HOF,OFFN,TIN
4619,hasoc_en_4620,White House Washigton DC,HOF,PRFN,TIN
476,hasoc_en_477,What could be more important than attending a debate that Millions of lives depend on ? ,NOT,NONE,NONE
2180,hasoc_en_2181,Brexit on WTO terms ?  Great news for jam lovers  .  . ,NOT,NONE,NONE
3789,hasoc_en_3790,"I remember when they were no hawks around or foxes or eagles but I saw for my own eyes working out there when Obama started regulating the environment ,  these majestic creatures came back full force",NOT,NONE,NONE
2971,hasoc_en_2972,"If a doctor start assaulting people I can guarantee u guys no one will be saved bcz no one knows how to save a life better then us  ,  but we believe in saving life ' s as it ' s our duty above all other things . ",NOT,NONE,NONE
1646,hasoc_en_1647,Shining Diva Italian Designer Non Precious Metal Jewellery Set Rs . 398 More : ,NOT,NONE,NONE
4412,hasoc_en_4413,"So is now on Twitter and it makes me wonder if his Tweets will make him a Twitter community pillar ,  or as in real life ,  a double murdering killer ? ",NOT,NONE,NONE
4956,hasoc_en_4957,Johnson on businesses threatened by  :   ' F *  *  *  business !  '  Boris Johnson on the families of victims of  / 7 terrorist attacks :   ' F *  *  *  the families !  '  Tories supporting  ' s bid to be PM :   ' F *  *  *  the country !  ' ,HOF,HATE,TIN
173,hasoc_en_174," ,  think of its family !  !  !  ! ",NOT,NONE,NONE
5662,hasoc_en_5663,What to do about a and a party that supports him,HOF,HATE,TIN
2187,hasoc_en_2188,Good point raised on Indian TV  -  takes a bigger load of money from India and robs the Indian fans of WC experience  -  so Indians are being robbed twice !  !  Shame on for letting ICc get away Why should a toothless org like run the game ? ,NOT,NONE,NONE
484,hasoc_en_485,Odisha docs hold protest in support of agitating doctors in,NOT,NONE,NONE
2764,hasoc_en_2765,LMAO !  Gross .  What a trainwreck .  Gay,HOF,HATE,TIN
868,hasoc_en_869,"Great ,  I ' ve gotten several tickets to your show .  I then wipped my ass with them and burnt them . ",HOF,PRFN,TIN
4451,hasoc_en_4452,Hypocrit  .  . ,HOF,OFFN,TIN
353,hasoc_en_354,"is the only incident in Karnataka where RSS  , VHP , BD  & amp ;  Modi is not blamed by the leftist liberals till now  ! ",NOT,NONE,NONE
4046,hasoc_en_4047, .  Someone get him some water from North Carolina and force down his throat . ,HOF,HATE,TIN
