,text_id,text,task_1,task_2,task_3
359,hasoc_en_360,I stand with Ms  .  This Balidan is nothing to do with game .  . ,NOT,NONE,NONE
4387,hasoc_en_4388,Nice to see that a Schizophrenic Chamcha is hiding behind a Schizophrenic media platform .  Two fellow Mental patients helping each other out . ,NOT,NONE,NONE
4100,hasoc_en_4101,this was a police officer ?  !   & amp ;  this is his side job ?  !  this kind of shit is a direct line to trump . he has fukd this whole world up .  im sure it brings him pleasure to know he is as infamous as Hitler .  .  finally !  something hes good at .  .  HATE,HOF,HATE,TIN
2797,hasoc_en_2798,Wow !  Look at all the lines of buyers !  !  !  Was the store closed or is that just the typical turnout ?  ? ,HOF,HATE,UNT
5109,hasoc_en_5110,impeach that arrogant piece of shit nOW,HOF,PRFN,TIN
3539,hasoc_en_3540,"Absolutely brutal , what them young kids went through .  For no reason ,  they suffered because of politics who wants to kill kids of America who were innocent",HOF,OFFN,TIN
5843,hasoc_en_5844,I seem to remember a radio show that called you to offer dirt on President Trump .  You sounded pretty eager for it . ,HOF,PRFN,TIN
422,hasoc_en_423,You belong in jail and then in hell,HOF,HATE,TIN
1792,hasoc_en_1793,"Indian democracy needs a constructive opposition not an elitist ,  dynastic ,  entitled and a pampered son . ",NOT,NONE,NONE
1485,hasoc_en_1486,"We remember Jackie ,  M is no Jackie",NOT,NONE,NONE
4391,hasoc_en_4392,"That whole birthday ego stroke session in the rose garden ,  as that was looking around with that big smile on his face ,  was  . ",HOF,OFFN,TIN
3750,hasoc_en_3751,How You Can Tell Barr Is Lying About Muellers Evidence,NOT,NONE,NONE
5389,hasoc_en_5390, ?  ?  ?  ?  But why ?  Will the symbol affect his performance on bit ?  Hell No !  He will remain the same lower - order batsman who will continue to bore us to death with his ultra - slow batting .  Utterly silly outrage by bhakts . ,HOF,HATE,UNT
3235,hasoc_en_3236,And for my next roll  .  .  .  .  say hello to  .  .  .  shes  .  .  .  and well a,NOT,NONE,NONE
2844,hasoc_en_2845,"The ppl who have dirtied Ma Ganga over d years deliberately r today abusing just coz he has taken it upon himself clean up d mess .   ,  how long your neech behavior ?  Get real",HOF,HATE,TIN
2768,hasoc_en_2769,before calling him immature just think about yourself .  .  you were banned for matches by ICC for your inappropriate behaviour .  .  .  .  is the pride of our crore hearts  .  .  .  .  .  . ,HOF,HATE,TIN
5152,hasoc_en_5153,"When VidyaSagar Statue breaks CM reaches within hour for sympathy and for earning Votes but when doctors get beaten by Pak Muslim goons CM has got no time .  .  Only has got time for threatening doctors ,  their Family members .  .  and stand United . ",NOT,NONE,NONE
1196,hasoc_en_1197,Entitled privileged attitude of the British elite establishment mafia ruling class .  .  .  .  .  says it all and why,NOT,NONE,NONE
255,hasoc_en_256,I stand by the Doctors who are fighting for their respect  & amp ;  dignity .  They save our lives  & amp ;  are like god on ground .  I strongly condemn attack on them by the goons in politics . ,NOT,NONE,NONE
4896,hasoc_en_4897,Because and can not be trusted by this country !  you have allowed this to continue and you will be held accountable,HOF,HATE,TIN
1013,hasoc_en_1014,And the protest is on,NOT,NONE,NONE
1576,hasoc_en_1577,"Honeys ,  Fellow Veterans and Active Duty ,  We All feel this way ! ",NOT,NONE,NONE
717,hasoc_en_718,Christopher you really do fancy yourself dont you with a chin like that youre easy pickings meant to be a politician as well very professional . ,NOT,NONE,NONE
321,hasoc_en_322,We are with you,NOT,NONE,NONE
2481,hasoc_en_2482,Has Sold Out America To The Fricking Enemy Russian Commie Soviet  ' REDS '   ' NOW '  Nuff Said  !   . ,HOF,HATE,TIN
652,hasoc_en_653,this is eerily similar to how the Vietnam War started,NOT,NONE,NONE
5723,hasoc_en_5724,Sounds like Netflix has a credibility issue . ,NOT,NONE,NONE
3301,hasoc_en_3302,"Don ' t be ridiculous !  He is seeking the job of leading the country  & amp ;  should be accountable to his stakeholders .  I regularly attend customer / stakeholder events  & amp ;  am expected to be well prepared ,  honest  & amp ;  transparent  -  or I would be sacked . ",NOT,NONE,NONE
699,hasoc_en_700," .  to V Srivatsa ,  Sr Journalist :  The statement ,  ICC has issued ,  talks about how reserved days couldnt have been made because this would make the tournament very long .  Is that an argument we should accept ? ",NOT,NONE,NONE
2711,hasoc_en_2712,Agree .  By The hand of  . ,NOT,NONE,NONE
4720,hasoc_en_4721,"ever in cricket .  Umpires  ,  rain and now this  .  Domestic tournaments are organised better than this",HOF,HATE,TIN
5590,hasoc_en_5591,SHE ' S  ' HONORED '  TO HAVE ADMITTED TO LYING FOR TRUMP ?  Sarah Sanders on working at White House :  Honor of a lifetime via,HOF,HATE,TIN
3365,hasoc_en_3366,"Holy shit ,  guys ,  we crushed my k goal !  Think I got everyone back .  Thanks so much ! ",NOT,NONE,NONE
3450,hasoc_en_3451,"I have more respect  & amp ;  like the US mil more than Trump for which Ill be a Statist for a minute to wish the branches a Happy Birthday .  As an  - yes ,  that saying a lot . ",NOT,NONE,NONE
1928,hasoc_en_1929,Representative Duncan Hunters Wife Pleads Guilty in Corruption Case,NOT,NONE,NONE
1310,hasoc_en_1311,"Well he figured he git away with it the first time ,  why not do it again . ",NOT,NONE,NONE
32,hasoc_en_33,fuck you and go fuck yourself you piece of shit someone get this asshole a jail cell for his birthday,HOF,PRFN,TIN
5249,hasoc_en_5250,"I really ,  really ,  really hope this happens !   (  ) ",NOT,NONE,NONE
1892,hasoc_en_1893,DON ' T This Because Doesn ' t Want You To Retweet His Fear,NOT,NONE,NONE
4853,hasoc_en_4854,Do you think Mamata Banerjee should resign as CM of West Bengal as she has failed to protect the doctors .  Or President Rule should be imposed RT  =  AGREE Likeresident Rule,HOF,HATE,TIN
4644,hasoc_en_4645,Twitter :  is Trending ICC :  Wtf ?  WHY ?  Indians : ,HOF,HATE,TIN
527,hasoc_en_528,doctors have already resigned in  .  NRS SSKM National medical college RG Kar North Bengal college Murshidabad Rampurhat Burdwan,NOT,NONE,NONE
1843,hasoc_en_1844,Not even Fox News believes,NOT,NONE,NONE
1119,hasoc_en_1120,ICC turns down  ' s request to allow to continue wearing the army insignia on his wicket - keeping gloves ;  ICC says regulations for ICC events do not permit any individual message or logo to be displayed on any items of clothing or equipment . ,NOT,NONE,NONE
4993,hasoc_en_4994,Angela M .  Thomas  (  )  Tweeted : ,NOT,NONE,NONE
3876,hasoc_en_3877,"what a disgusting country we live in ,  this goverment pours trillions into the military industrial complex but we can help our own people overhere who risked their own lives on  / 11",HOF,PRFN,TIN
1376,hasoc_en_1377,"Funny how talking about remaking GOT s8  & amp ;  signing petitions for that was more important to you than people who work hard day  & amp ;  night to serve you  & amp ;  are getting threats of acid attacks ,  death threats and are being beaten up . ",NOT,NONE,NONE
1112,hasoc_en_1113, ' Blame is your own .  .  '   ' Covering up  ' a lack of Democracy '  within the CON  ' Regress '  is not going to improve the fortunes of your Party .  ' ,NOT,NONE,NONE
189,hasoc_en_190,I fully endorse You Sir .  .  .  .  .  This is about our  .  .  .  .  .  .  .  I am of the Opinion,NOT,NONE,NONE
1838,hasoc_en_1839,"History of humanity has taught us that no great victory comes without a greater revolution  ,  and today we ask you to support our cause by using this hashtag hence helping end this discrimination and oppression . ",NOT,NONE,NONE
4393,hasoc_en_4394,Big breaking news massive vacancy in health care sector in Waste Bengal .  mamataj banu will recruit civic doctors  .  qualification -  TMC supporter Butchers from piss full will be recruited as surgeon .  Apply now,HOF,PRFN,TIN
1476,hasoc_en_1477,Fuck Trump and anybody who voted for that Lyin POS ! ,HOF,PRFN,TIN
3341,hasoc_en_3342,"It takes years to become a surgeon and a lifetime to become a good one .  Please respect us and what we do .  Do not hit doctors ,  burn hospitals ,  you have the right to express but there are better ways to do it !   . ",NOT,NONE,NONE
3562,hasoc_en_3563,We all know how you feel !  Cold War Steve :  satire is my antidote to a scary world,NOT,NONE,NONE
4385,hasoc_en_4386,Welcome to ICC  ( Islamic Cricket Council )  where Pakis offering namaz is peaceful  & amp ;  obedient af . But Dhonis gloves with balidan ( sacrifice )  badge is offensive  & amp ;  against the rules . ,HOF,HATE,TIN
2524,hasoc_en_2525,Embassies worldwide are defying Trump  & amp ;  flying the Pride flag without permission,NOT,NONE,NONE
1710,hasoc_en_1711, .  .  .  .  your daughter lies so much you cant tell the difference betwern her and,NOT,NONE,NONE
3133,hasoc_en_3134,Offering namaz on field is not a bigg issue but Wearing glove containing Army logo  (  non political non religious not harming anyones sentiments  )  is objectable for icc  ! ,HOF,HATE,TIN
3924,hasoc_en_3925,Only if he finds you . ,NOT,NONE,NONE
997,hasoc_en_998,and yeah,HOF,PRFN,TIN
1802,hasoc_en_1803,Male Sheeps  |  Domestic Animal of Pakistan,NOT,NONE,NONE
4872,hasoc_en_4873,"Seen at the Rally yesterday .  Translation  :  Why should we leave hostel ?  Is it your party office ?  In order to enter into this hostel ,  one needs to clear NEET exam ,  and you don ' t have such capability . ",HOF,HATE,UNT
3730,hasoc_en_3731," ' I often hear Tories muse ,  Johnson as PM will cheer everyone up .  When your party looks like it is going to hell in a handcart ,  they reckon you might as well hurtle towards the inferno with a smile on your face ' ",NOT,NONE,NONE
3848,hasoc_en_3849,threat,NOT,NONE,NONE
2542,hasoc_en_2543,"Nothing much has changed at the since August  ,  when went on strike demanding security at workplace .  They are still assaulted now and then by patients relatives ,  who go scot free",NOT,NONE,NONE
1744,hasoc_en_1745,It is reported that Your Government wanted to provide Guarantee to those who had invested in  .  Is protecting those who cheat Minorities Your way of Minority Welfare ?  Why are You putting the lives of thousands of Innocents to save few Fraudsters ?  Is this  ' Raja Dharma '  ? ,NOT,NONE,NONE
1265,hasoc_en_1266,"In one interview ,  referred to  ,  a convicted  ,  as the real victim . ",NOT,NONE,NONE
1719,hasoc_en_1720,"well clutch my pearls .  .  .  OMG you have feelings and support Trump ?  Sorry ,  I dont believe you ! ",NOT,NONE,NONE
5095,hasoc_en_5096,Papadopoulos Taunts Obama ' s Crooked FBI :   ' The Secret Transcripts of My Meeting with Alexander Downer Are Ready to Come Out '  via listening to yesterday was is a dirty cop,NOT,NONE,NONE
5567,hasoc_en_5568,Majority of American millionaires support a wealth tax on American millionaires,HOF,PRFN,TIN
2447,hasoc_en_2448,Parliment is the temple of Indian democracy and no unparliamentary words should be used .  Moreover it shows the character of the person using it . ,NOT,NONE,NONE
4326,hasoc_en_4327,ICC trying to control Dhoni on gloves vs ICC deciding world cup matches,HOF,HATE,TIN
5845,hasoc_en_5846,"It seems the Rain  & amp ;  thunder god only like to see playing on the field !  Why such discrimination ,  eh ! ",HOF,HATE,TIN
3435,hasoc_en_3436,Wonderful guys  -  making money out of others misery  -  a brilliant  . ,NOT,NONE,NONE
1528,hasoc_en_1529,Our voices shall be heard  !  This cause needs more media coverage because public health and education do matter and being oppressed in this brutal way is NOT okay  ! ,NOT,NONE,NONE
5014,hasoc_en_5015,Group of people ( probably goons of TMC )  attacked on a nd year medical student at pm at Calcutta National Medical College NOW .  THIS HAS TO STOP !  It is never ending ! ,HOF,HATE,TIN
5235,hasoc_en_5236,"I don ' t understand why the have to be this towards black / brown people in  ,  over the most pettiest of issues .  You ' d swear they were trying to take down a  ,  or something .  .  .  but over a USD Doll ?  REALLY ?  ? ",NOT,NONE,NONE
843,hasoc_en_844,Where is sports spirit  ?  ?  ?  Game is not great than love for country .  .  .  . ,NOT,NONE,NONE
5170,hasoc_en_5171,LOST THE POPULAR VOTE .  THE AMERICAN VOTER HATES LOSER TRUMP ! ,NOT,NONE,NONE
3877,hasoc_en_3878,"Rape culture cw /  /   ' No ,  but I know him ,  and he ' s not like that .  '  No ,  he ' s another kind of  . ",NOT,NONE,NONE
4284,hasoc_en_4285,"I wouldnt trust Boris Johnson to put a lead on a dog ,  let alone lead the nation",HOF,PRFN,TIN
1729,hasoc_en_1730,Fixed it for you,NOT,NONE,NONE
3893,hasoc_en_3894,"We have ZERO interest in playing GOD ,  so please don ' t treat us either as a GOD or as a DOG !  If you deserve respect ,  so do we ,  nothing more and nothing less .  .  . ",NOT,NONE,NONE
751,hasoc_en_752,Ok Needs to go .  .  .  Please Oh Please Luke gives A whole new meaning ! ,NOT,NONE,NONE
2276,hasoc_en_2277,Dear you haven ' t done right We stand by,NOT,NONE,NONE
3130,hasoc_en_3131,They ' re going to quickly throw her ass in a retirement home and be done with her as soon as they get the chance . ,HOF,PRFN,TIN
1727,hasoc_en_1728,Love this and,NOT,NONE,NONE
2324,hasoc_en_2325,"After controversy  ,  calls doctors outsiders protesting on behalf of other political parties Dear Mamata didi ,  instead of blaming Doctors perhaps you should introspect once for a change",NOT,NONE,NONE
2865,hasoc_en_2866,"A hearty fuck you to this ALL DAY sweep notice ,  targeting an individual unhoused resident in Chinatown .   \ n \ nThis is so cruel ,  forcing someone to choose between guarding objects they need to survive  ( tents ,  medication )  and going anywhere  ( work ,  doctor \  ' s appt )  .  \ n \ n",HOF,PRFN,TIN
558,hasoc_en_559,Due to the controversy created by and no support from on I am not watching any of the cricket match . ,NOT,NONE,NONE
2493,hasoc_en_2494,And after that modi will be distribute cr scholarship to minority ji we should demand to for,NOT,NONE,NONE
3554,hasoc_en_3555,"what kind of country have we become when we hold wit ,  humour and charisma in higher regard than intellect ,  competence ,  and understanding ?  Our world is becoming a reflection of reality TV ,  a diluted and thinned version of what was once good . ",NOT,NONE,NONE
2229,hasoc_en_2230,She has proved the saying of our  .  .  .   ' Vinaash Kale Vipreit Buddhi '  meaning when one ' s doom approaches .  . the person intellect works against his / her best interest . ,NOT,NONE,NONE
452,hasoc_en_453,"Obviously ,  you don ' t know anything about  .  .  .  . ",NOT,NONE,NONE
467,hasoc_en_468,I Helped Obama Win in  .  Now Trump Is Using the Same Playbook . ,NOT,NONE,NONE
303,hasoc_en_304,Indian commentator soiling about whether nails are necessary .  . ,NOT,NONE,NONE
160,hasoc_en_161,Now plz stop it .  .  . ,NOT,NONE,NONE
4588,hasoc_en_4589,Correction .  .  .  . Succeeded in re - branding today as because  . ,NOT,NONE,NONE
4396,hasoc_en_4397,Thanks for fund raising on the promise of Obamacare repeal from Republican voters only to screw them over by deciding it was more important to put yourself first just to screw Trump in a personal vendetta .   ' preciate it . ,NOT,NONE,NONE
3779,hasoc_en_3780,with money can commit even murder and never face any consequence . ,NOT,NONE,NONE
5003,hasoc_en_5004,A billion Cricket fans waited four years to watch how it rains in England,HOF,HATE,TIN
4240,hasoc_en_4241,Of course he ' ll shoot his age !  He cheats . ,HOF,HATE,TIN
658,hasoc_en_659,What a fucking idiotic thing to do !  Threaten proper journalists for supposedly being biased while working for one of the worst disinformation newspapers around ! ,HOF,PRFN,UNT
3401,hasoc_en_3402,Mine is also country . ,NOT,NONE,NONE
3823,hasoc_en_3824,"No we still want you impeached ,  just because I didnt show up to rally ! ",NOT,NONE,NONE
4390,hasoc_en_4391,Well done friends .  Don ' t meet arrogant Mamta .  Government must pass ordinance to protect medical staff on urgent basis . ,NOT,NONE,NONE
1614,hasoc_en_1615,Why we need a,NOT,NONE,NONE
4768,hasoc_en_4769,Chal hatt supporter BJP KA DALAL,HOF,OFFN,UNT
1065,hasoc_en_1066,Embassies worldwide are defying Trump  & amp ;  flying the Pride flag without permission .  Gotta love that attitude ~ ,NOT,NONE,NONE
831,hasoc_en_832,"after  +  years ,  nothing the does in support of trump is surprising  .  .  .  disappointing ,  but not surprising . ",NOT,NONE,NONE
3866,hasoc_en_3867,in Bengal Vs in Bihar .  When people will get the proper quality medical services without reservations ?  Surely a Curse now blaming leeches today n mangoes Tommorrow in fighting,NOT,NONE,NONE
3271,hasoc_en_3272,"Many a time ,  we Indians chooseour hearts over our heads .  Holding tight all that we believe in ,  we confidently tread beyond the realm ofrational thinking . ",NOT,NONE,NONE
3935,hasoc_en_3936,Happy,NOT,NONE,NONE
525,hasoc_en_526,Today would have been my year anniversary with my ex and my calendar just kindly reminded of it since I forgot to delete the alert after we broke up,NOT,NONE,NONE
2904,hasoc_en_2905,"If you  &  ur other congressi brothers  &  sisters dont know how spk in Hindi then spk in the language u know , there r translators there .  \ nFact is all of u r insulting PM ji on instructions of Gandhis to please them .  Shameful !   \ n",HOF,HATE,TIN
1752,hasoc_en_1753,govt .  should think about security to doctors . ,NOT,NONE,NONE
5482,hasoc_en_5483,won in only because of the help from Russians and he is very willing for them to help him again . ,HOF,HATE,TIN
683,hasoc_en_684,Can doctors go on strike after their working hours  ?  Little children  & amp ;  helpless patients are dying . ,NOT,NONE,NONE
5380,hasoc_en_5381,That stupid ass haircut alone says it all  .  .  .  once a always a douchebag  . ,HOF,HATE,TIN
3662,hasoc_en_3663,Seriously ?  You live in a different reality than the rest of America . ,NOT,NONE,NONE
1939,hasoc_en_1940,Three times more allotment to than for India ' s  .  Proves bias .  English cricket couldn ' t buy covers for Trent Bridge .  Four matches wasted .  Imagine losses for fans who traveled from abroad .  Mean could have decided Champion by toss of coin . ,NOT,NONE,NONE
33,hasoc_en_34,Donald Trump lies .  Happy  ! ,NOT,NONE,NONE
4761,hasoc_en_4762,shop :  Benedict Donald so called president is a traitor Short - Sleeve Unisex T - Shirt,NOT,NONE,NONE
2832,hasoc_en_2833,Waris live in India like a Indian human and not hide behind that Muslim garb .  Do your people want to insult the highest political institutions of India because you are Muslims and then cry foul .  Shut up you non identical stupid . ,HOF,HATE,TIN
4064,hasoc_en_4065,Life in GITMO for traitor Trump and all the GOP co - conspirators ! ,HOF,OFFN,TIN
1510,hasoc_en_1511,dear media  & amp ;  doctors i am just as upset the way u ' ve been treated .  . Bt just wanted to know why wasn ' t this agitation  & amp ;  protest wen of ur colleague was killed .  . if slap cud agitate u so much wat bout life  & amp ;  nw others suffering . ,NOT,NONE,NONE
533,hasoc_en_534,Seriously what the fuck is up this his hair line that shit is disgusting I hate this motherfucker,HOF,PRFN,TIN
4945,hasoc_en_4946,U . S .  Lifts Ban on Some Elephant and Lion Trophies So they are blaming this Shit on Obama ?  and,HOF,HATE,TIN
2454,hasoc_en_2455,"Again Congress started abusing PM from day  .  So pathetic and tragic .  Matilaal ,  JawaharlalN ,  IndiraG ,  all were character - corrupt ,  and now IndiraG is MaGanga !  And Mr Modi is Gandi Naali  !  Even bastards never speak this language .  Hate these parliamentarians . ",HOF,PRFN,TIN
3348,hasoc_en_3349,A Chinese takeaway was more important ! ,NOT,NONE,NONE
4051,hasoc_en_4052,"You ' re as delusional as ever .  The economy sucks .  No healthcare .  Funding cut to Medicare ,  schools and Special needs children and adults .  Your so called  ' wall '  is a joke .  You are responsible for the kidnapping  & amp ;  murder of innocent refugee children . ",HOF,HATE,TIN
1823,hasoc_en_1824,u have anything to say on this ?  ?  Should we also start bhajan - kirtan before match starts ? ,NOT,NONE,NONE
2662,hasoc_en_2663,Those who voted him in are just as disgusting as he is .  Shame !  !  ! ,NOT,NONE,NONE
3298,hasoc_en_3299,It should be National John McCain day because  !  !  ! ,NOT,NONE,NONE
4047,hasoc_en_4048,"Oh shut up you  ,   !  in blocking All Bills sent to you .  .  .  . ",HOF,PRFN,TIN
2607,hasoc_en_2608,Who should do investigation for  ?  Th scam in Karnataka  .  More than victims due to poor governance by State Govt . ,NOT,NONE,NONE
2479,hasoc_en_2480,Why is this creature even alive ?  ? ,NOT,NONE,NONE
5248,hasoc_en_5249,The FBI Director was RIGHT !  !  ! ,HOF,OFFN,TIN
4804,hasoc_en_4805,Trump is the Prince of Hippos . ,NOT,NONE,NONE
2990,hasoc_en_2991,in a as in d build up to d match on th .  We take strong objection to it pls do something don ' t expect anything from we saw d issue left us red - faced,HOF,HATE,TIN
327,hasoc_en_328,Why don ' t you mention khatre main ? ,NOT,NONE,NONE
1085,hasoc_en_1086,Hilarious because closely brushing the truth Boris Johnson dodging public debates to avoid inadvertently fathering a child during one  -  via,NOT,NONE,NONE
2474,hasoc_en_2475,So why is being silenced by his carers if he has such a wonderful plan ? ,NOT,NONE,NONE
5775,hasoc_en_5776,has no problem with the entire Pakistan cricket team marking territory by praying on the cricket field  ( part of Muslim ritual prayer )  but find insignia on  ' s gloves inappropriate . ,HOF,HATE,TIN
5140,hasoc_en_5141,Nothing more ignorant than forcing everyone to hear your conversation .  .  . ,NOT,NONE,NONE
834,hasoc_en_835,"Try again ,  are an embarrassment to this country . ",NOT,NONE,NONE
367,hasoc_en_368,"Mikey promises to solve the  ,  but he already has his hands full with the full - fledged still on the loose .  available at Amazon  -  -  & gt ; ",NOT,NONE,NONE
4162,hasoc_en_4163,"Happily Queen dahlingsss make his day hellsss ,  LivingHELLSSS",HOF,HATE,UNT
5026,hasoc_en_5027,Child must die .  And all those who tried to dispose evidence should get,HOF,OFFN,TIN
2377,hasoc_en_2378,Everyone should be scared that doesn ' t know the difference between right and wrong . ,NOT,NONE,NONE
1656,hasoc_en_1657,I want to send a pre - birthday FUCK YOU to Trump for all hes done to this country . ,HOF,PRFN,TIN
4983,hasoc_en_4984,was to much of a coward to turn up at the program  ?  Because people might see him for the simpleton that he is ?  Or because hes a genius and didnt have to turn up ? ,HOF,HATE,TIN
1515,hasoc_en_1516,for organising such an important tournament at such a time when half of the matches are getting washed away .  .  .  .  .  . ,HOF,HATE,TIN
352,hasoc_en_353,The US is not briefing on major cyber warfare operations against  & amp ;  other hostile foreign powers .  They don ' t trust him not to betray operations TO those enemy nations  -  because he ' s already done it before . ,NOT,NONE,NONE
402,hasoc_en_403,Disgusting !  And they dont change their culture or come up with vetting system or preventative ways to stop this from occurring .  This will continue to happen .  The Catholic Church needs to go ! ,HOF,HATE,TIN
1761,hasoc_en_1762,Is that Possible for Biggest Battel On English Ground .  .  .  .  . ,NOT,NONE,NONE
2070,hasoc_en_2071,Dhoni should boycott this CWC .  We have as a Best captain .  He will make India win .  shame on you that you are still just silent .  Show some goodness for your country and  . ,NOT,NONE,NONE
2908,hasoc_en_2909,Sir please look into Bihar children too .  .  .  .  the need your attention very much .  Remember that that Children ' s family also done vote in your favour .  .  . ,NOT,NONE,NONE
1737,hasoc_en_1738,This is what your country will soon look like if you EVER let in - in any wayFinance / joint ventures / land ownership / infrastructure or GYes they own HK but we got complacent while Britain had its year lease - this is no longer the we knew ! ,NOT,NONE,NONE
5268,hasoc_en_5269,Did Warner use the information about you while running against you in a Presidential election ?  Did Adam Schiff ?  Stupid piece of shit ! ,HOF,OFFN,TIN
1396,hasoc_en_1397,"Imagine if thought were energy that could be harnessed and focused ,  on a day like today ,  on CheesePuff in Chiefs birthday ,  he would certainly burst into flames from all the negative energy being thown his way . ",NOT,NONE,NONE
1825,hasoc_en_1826,Just goes to show the HATE and VILE comments on Twitter .  Anti - American Left Wing Nuts  .  .  .  .  .  . ,NOT,NONE,NONE
1471,hasoc_en_1472,"According to The Times and the Daily Mail ,  Brussels believe that whoever wins the Conservative leadership race will agree to an extension to the UKs departure from the EU .  . ",NOT,NONE,NONE
123,hasoc_en_124,"The whole gloves controversy during  ,  is outright immature  & amp ;  mindless .  Id understand if there was anyone else youd question the integrity  & amp ;  intention of ,  but not this guy .  He is as pure  & amp ;  genuine an ambassador of Sport ,  as youll ever get . ",NOT,NONE,NONE
5135,hasoc_en_5136,cannot believe people don ' t see these autos stopped in front of them .  drivers,NOT,NONE,NONE
4158,hasoc_en_4159,"What a shameful  .  You dont have any problem with the logos of drinks ,  tobacco  ,  cold drinks  ,  Whichever is injurious to health but an INDIAN Balidan badge is a problem for u .  .  .  Strange isnt it  ? ",HOF,HATE,TIN
431,hasoc_en_432," :  While some are using Trump ' s rd birthday to celebrate John McCain ,  are hoping the celebrates next year with a on his  . ",NOT,NONE,NONE
5799,hasoc_en_5800,Youre a white person who promotes the racist agenda of MAGA and youre telling people to stop with the race card You must live in that world where all the other fartman lovers live .  .  .  DENIAL LAND ! ,HOF,HATE,TIN
